Id,ProductId,UserId,ProfileName,HelpfulnessNumerator,HelpfulnessDenominator,Score,Time,Summary,SentenceNo,Text
1,B001E4KFG0,A3SGXH7AUHU8GW,delmartian,1,1,5,1303862400,Good Quality Dog Food,0,I have bought several of the Vitality canned dog food products and have found them all to be of good quality.
1,B001E4KFG0,A3SGXH7AUHU8GW,delmartian,1,1,5,1303862400,Good Quality Dog Food,1,The product looks more like a stew than a processed meat and it smells better.
1,B001E4KFG0,A3SGXH7AUHU8GW,delmartian,1,1,5,1303862400,Good Quality Dog Food,2,My Labrador is finicky and she appreciates this product better than  most.
2,B00813GRG4,A1D87F6ZCVE5NK,dll pa,0,0,1,1346976000,Not as Advertised,0,Product arrived labeled as Jumbo Salted Peanuts...the peanuts were actually small sized unsalted.
2,B00813GRG4,A1D87F6ZCVE5NK,dll pa,0,0,1,1346976000,Not as Advertised,1,"Not sure if this was an error or if the vendor intended to represent the product as ""Jumbo""."
3,B000LQOCH0,ABXLMWJIXXAIN,"Natalia Corres ""Natalia Corres""",1,1,4,1219017600,"""Delight"" says it all",0,This is a confection that has been around a few centuries.
3,B000LQOCH0,ABXLMWJIXXAIN,"Natalia Corres ""Natalia Corres""",1,1,4,1219017600,"""Delight"" says it all",1,"It is a light, pillowy citrus gelatin with nuts - in this case Filberts."
3,B000LQOCH0,ABXLMWJIXXAIN,"Natalia Corres ""Natalia Corres""",1,1,4,1219017600,"""Delight"" says it all",2,And it is cut into tiny squares and then liberally coated with powdered sugar.
3,B000LQOCH0,ABXLMWJIXXAIN,"Natalia Corres ""Natalia Corres""",1,1,4,1219017600,"""Delight"" says it all",3,And it is a tiny mouthful of heaven.
3,B000LQOCH0,ABXLMWJIXXAIN,"Natalia Corres ""Natalia Corres""",1,1,4,1219017600,"""Delight"" says it all",4,"Not too chewy, and very flavorful."
3,B000LQOCH0,ABXLMWJIXXAIN,"Natalia Corres ""Natalia Corres""",1,1,4,1219017600,"""Delight"" says it all",5,I highly recommend this yummy treat.
3,B000LQOCH0,ABXLMWJIXXAIN,"Natalia Corres ""Natalia Corres""",1,1,4,1219017600,"""Delight"" says it all",6,"If you are familiar with the story of C.S. Lewis' ""The Lion, The Witch, and The Wardrobe"" - this is the treat that seduces Edmund into selling out his Brother and Sisters to the Witch."
4,B000UA0QIQ,A395BORC6FGVXV,Karl,3,3,2,1307923200,Cough Medicine,0,If you are looking for the secret ingredient in Robitussin I believe I have found it.
4,B000UA0QIQ,A395BORC6FGVXV,Karl,3,3,2,1307923200,Cough Medicine,1,I got this in addition to the Root Beer Extract I ordered (which was good) and made some cherry soda.
4,B000UA0QIQ,A395BORC6FGVXV,Karl,3,3,2,1307923200,Cough Medicine,2,The flavor is very medicinal.
5,B006K2ZZ7K,A1UQRSCLF8GW1T,"Michael D. Bigham ""M. Wassir""",0,0,5,1350777600,Great taffy,0,Great taffy at a great price.
5,B006K2ZZ7K,A1UQRSCLF8GW1T,"Michael D. Bigham ""M. Wassir""",0,0,5,1350777600,Great taffy,1,There was a wide assortment of yummy taffy.
5,B006K2ZZ7K,A1UQRSCLF8GW1T,"Michael D. Bigham ""M. Wassir""",0,0,5,1350777600,Great taffy,2,Delivery was very quick.
5,B006K2ZZ7K,A1UQRSCLF8GW1T,"Michael D. Bigham ""M. Wassir""",0,0,5,1350777600,Great taffy,3,"If your a taffy lover, this is a deal."
6,B006K2ZZ7K,ADT0SRK1MGOEU,Twoapennything,0,0,4,1342051200,Nice Taffy,0,I got a wild hair for taffy and ordered this five pound bag.
6,B006K2ZZ7K,ADT0SRK1MGOEU,Twoapennything,0,0,4,1342051200,Nice Taffy,1,"The taffy was all very enjoyable with many flavors: watermelon, root beer, melon, peppermint, grape, etc."
6,B006K2ZZ7K,ADT0SRK1MGOEU,Twoapennything,0,0,4,1342051200,Nice Taffy,2,My only complaint is there was a bit too much red/black licorice-flavored pieces (just not my particular favorites).
6,B006K2ZZ7K,ADT0SRK1MGOEU,Twoapennything,0,0,4,1342051200,Nice Taffy,3,"Between me, my kids, and my husband, this lasted only two weeks!"
6,B006K2ZZ7K,ADT0SRK1MGOEU,Twoapennything,0,0,4,1342051200,Nice Taffy,4,I would recommend this brand of taffy -- it was a delightful treat.
7,B006K2ZZ7K,A1SP2KVKFXXRU1,David C. Sullivan,0,0,5,1340150400,Great!  Just as good as the expensive brands!,0,This saltwater taffy had great flavors and was very soft and chewy.
7,B006K2ZZ7K,A1SP2KVKFXXRU1,David C. Sullivan,0,0,5,1340150400,Great!  Just as good as the expensive brands!,1,Each candy was individually wrapped well.
7,B006K2ZZ7K,A1SP2KVKFXXRU1,David C. Sullivan,0,0,5,1340150400,Great!  Just as good as the expensive brands!,2,"None of the candies were stuck together, which did happen in the expensive version, Fralinger's."
7,B006K2ZZ7K,A1SP2KVKFXXRU1,David C. Sullivan,0,0,5,1340150400,Great!  Just as good as the expensive brands!,3,Would highly recommend this candy!
7,B006K2ZZ7K,A1SP2KVKFXXRU1,David C. Sullivan,0,0,5,1340150400,Great!  Just as good as the expensive brands!,4,I served it at a beach-themed party and everyone loved it!
8,B006K2ZZ7K,A3JRGQVEQN31IQ,Pamela G. Williams,0,0,5,1336003200,"Wonderful, tasty taffy",0,This taffy is so good.
8,B006K2ZZ7K,A3JRGQVEQN31IQ,Pamela G. Williams,0,0,5,1336003200,"Wonderful, tasty taffy",1,It is very soft and chewy.
8,B006K2ZZ7K,A3JRGQVEQN31IQ,Pamela G. Williams,0,0,5,1336003200,"Wonderful, tasty taffy",2,The flavors are amazing.
8,B006K2ZZ7K,A3JRGQVEQN31IQ,Pamela G. Williams,0,0,5,1336003200,"Wonderful, tasty taffy",3,I would definitely recommend you buying it.
8,B006K2ZZ7K,A3JRGQVEQN31IQ,Pamela G. Williams,0,0,5,1336003200,"Wonderful, tasty taffy",4,Very satisfying!!
9,B000E7L2R4,A1MZYO9TZK0BBI,R. James,1,1,5,1322006400,Yay Barley,0,Right now I'm mostly just sprouting this so my cats can eat the grass.
9,B000E7L2R4,A1MZYO9TZK0BBI,R. James,1,1,5,1322006400,Yay Barley,1,They love it.
9,B000E7L2R4,A1MZYO9TZK0BBI,R. James,1,1,5,1322006400,Yay Barley,2,I rotate it around with Wheatgrass and Rye too
10,B00171APVA,A21BT40VZCCYT4,Carol A. Reed,0,0,5,1351209600,Healthy Dog Food,0,This is a very healthy dog food.
10,B00171APVA,A21BT40VZCCYT4,Carol A. Reed,0,0,5,1351209600,Healthy Dog Food,1,Good for their digestion.
10,B00171APVA,A21BT40VZCCYT4,Carol A. Reed,0,0,5,1351209600,Healthy Dog Food,2,Also good for small puppies.
10,B00171APVA,A21BT40VZCCYT4,Carol A. Reed,0,0,5,1351209600,Healthy Dog Food,3,My dog eats her required amount at every feeding.
11,B0001PB9FE,A3HDKO7OW0QNK4,Canadian Fan,1,1,5,1107820800,The Best Hot Sauce in the World,0,"I don't know if it's the cactus or the tequila or just the unique combination of ingredients, but the flavour of this hot sauce makes it one of a kind!"
11,B0001PB9FE,A3HDKO7OW0QNK4,Canadian Fan,1,1,5,1107820800,The Best Hot Sauce in the World,1,We picked up a bottle once on a trip we were on and brought it back home with us and were totally blown away!
11,B0001PB9FE,A3HDKO7OW0QNK4,Canadian Fan,1,1,5,1107820800,The Best Hot Sauce in the World,2,When we realized that we simply couldn't find it anywhere in our city we were bummed.
11,B0001PB9FE,A3HDKO7OW0QNK4,Canadian Fan,1,1,5,1107820800,The Best Hot Sauce in the World,3,"<br /><br />Now, because of the magic of the internet, we have a case of the sauce and are ecstatic because of it."
11,B0001PB9FE,A3HDKO7OW0QNK4,Canadian Fan,1,1,5,1107820800,The Best Hot Sauce in the World,4,<br /><br />If you love hot sauce.
11,B0001PB9FE,A3HDKO7OW0QNK4,Canadian Fan,1,1,5,1107820800,The Best Hot Sauce in the World,5,.
11,B0001PB9FE,A3HDKO7OW0QNK4,Canadian Fan,1,1,5,1107820800,The Best Hot Sauce in the World,6,"I mean really love hot sauce, but don't want a sauce that tastelessly burns your throat, grab a bottle of Tequila Picante Gourmet de Inclan."
11,B0001PB9FE,A3HDKO7OW0QNK4,Canadian Fan,1,1,5,1107820800,The Best Hot Sauce in the World,7,"Just realize that once you taste it, you will never want to use any other sauce."
11,B0001PB9FE,A3HDKO7OW0QNK4,Canadian Fan,1,1,5,1107820800,The Best Hot Sauce in the World,8,"<br /><br />Thank you for the personal, incredible service!"
12,B0009XLVG0,A2725IB4YY9JEB,"A Poeng ""SparkyGoHome""",4,4,5,1282867200,"My cats LOVE this ""diet"" food better than their regular food",0,One of my boys needed to lose some weight and the other didn't.
12,B0009XLVG0,A2725IB4YY9JEB,"A Poeng ""SparkyGoHome""",4,4,5,1282867200,"My cats LOVE this ""diet"" food better than their regular food",1,"I put this food on the floor for the chubby guy, and the protein-rich, no by-product food up higher where only my skinny boy can jump."
12,B0009XLVG0,A2725IB4YY9JEB,"A Poeng ""SparkyGoHome""",4,4,5,1282867200,"My cats LOVE this ""diet"" food better than their regular food",2,The higher food sits going stale.
12,B0009XLVG0,A2725IB4YY9JEB,"A Poeng ""SparkyGoHome""",4,4,5,1282867200,"My cats LOVE this ""diet"" food better than their regular food",3,They both really go for this food.
12,B0009XLVG0,A2725IB4YY9JEB,"A Poeng ""SparkyGoHome""",4,4,5,1282867200,"My cats LOVE this ""diet"" food better than their regular food",4,And my chubby boy has been losing about an ounce a week.
13,B0009XLVG0,A327PCT23YH90,LT,1,1,1,1339545600,My Cats Are Not Fans of the New Food,0,My cats have been happily eating Felidae Platinum for more than two years.
13,B0009XLVG0,A327PCT23YH90,LT,1,1,1,1339545600,My Cats Are Not Fans of the New Food,1,I just got a new bag and the shape of the food is different.
13,B0009XLVG0,A327PCT23YH90,LT,1,1,1,1339545600,My Cats Are Not Fans of the New Food,2,They tried the new food when I first put it in their bowls and now the bowls sit full and the kitties will not touch the food.
13,B0009XLVG0,A327PCT23YH90,LT,1,1,1,1339545600,My Cats Are Not Fans of the New Food,3,I've noticed similar reviews related to formula changes in the past.
13,B0009XLVG0,A327PCT23YH90,LT,1,1,1,1339545600,My Cats Are Not Fans of the New Food,4,"Unfortunately, I now need to find a new food that my cats will eat."
14,B001GVISJM,A18ECVX2RJ7HUE,"willie ""roadie""",2,2,4,1288915200,fresh and greasy!,0,good flavor!
14,B001GVISJM,A18ECVX2RJ7HUE,"willie ""roadie""",2,2,4,1288915200,fresh and greasy!,1,these came securely packed... they were fresh and delicious!
14,B001GVISJM,A18ECVX2RJ7HUE,"willie ""roadie""",2,2,4,1288915200,fresh and greasy!,2,i love these Twizzlers!
15,B001GVISJM,A2MUGFV2TDQ47K,"Lynrie ""Oh HELL no""",4,5,5,1268352000,Strawberry Twizzlers - Yummy,0,The Strawberry Twizzlers are my guilty pleasure - yummy.
15,B001GVISJM,A2MUGFV2TDQ47K,"Lynrie ""Oh HELL no""",4,5,5,1268352000,Strawberry Twizzlers - Yummy,1,Six pounds will be around for a while with my son and I.
16,B001GVISJM,A1CZX3CP8IKQIJ,Brian A. Lee,4,5,5,1262044800,"Lots of twizzlers, just what you expect.",0,My daughter loves twizzlers and this shipment of six pounds really hit the spot.
16,B001GVISJM,A1CZX3CP8IKQIJ,Brian A. Lee,4,5,5,1262044800,"Lots of twizzlers, just what you expect.",1,It's exactly what you would expect...six packages of strawberry twizzlers.
17,B001GVISJM,A3KLWF6WQ5BNYO,Erica Neathery,0,0,2,1348099200,poor taste,0,I love eating them and they are good for watching TV and looking at movies!
17,B001GVISJM,A3KLWF6WQ5BNYO,Erica Neathery,0,0,2,1348099200,poor taste,1,It is not too sweet.
17,B001GVISJM,A3KLWF6WQ5BNYO,Erica Neathery,0,0,2,1348099200,poor taste,2,I like to transfer them to a zip lock baggie so they stay fresh so I can take my time eating them.
18,B001GVISJM,AFKW14U97Z6QO,Becca,0,0,5,1345075200,Love it!,0,I am very satisfied with my Twizzler purchase.
18,B001GVISJM,AFKW14U97Z6QO,Becca,0,0,5,1345075200,Love it!,1,I shared these with others and we have all enjoyed them.
18,B001GVISJM,AFKW14U97Z6QO,Becca,0,0,5,1345075200,Love it!,2,I will definitely be ordering more.
19,B001GVISJM,A2A9X58G2GTBLP,Wolfee1,0,0,5,1324598400,GREAT SWEET CANDY!,0,"Twizzlers, Strawberry my childhood favorite candy, made in Lancaster Pennsylvania by Y & S Candies, Inc. one of the oldest confectionery Firms in the United States, now a Subsidiary of the Hershey Company, the Company was established in 1845 as Young and Smylie, they also make Apple Licorice Twists, Green Color and Blue Raspberry Licorice Twists, I like them all<br /><br />I keep it in a dry cool place because is not recommended it to put it in the fridge."
19,B001GVISJM,A2A9X58G2GTBLP,Wolfee1,0,0,5,1324598400,GREAT SWEET CANDY!,1,"According to the Guinness Book of Records, the longest Licorice Twist ever made measured 1.200 Feet (370 M) and weighted 100 Pounds (45 Kg) and was made by Y & S Candies, Inc."
19,B001GVISJM,A2A9X58G2GTBLP,Wolfee1,0,0,5,1324598400,GREAT SWEET CANDY!,2,"This Record-Breaking Twist became a Guinness World Record on July 19, 1998."
19,B001GVISJM,A2A9X58G2GTBLP,Wolfee1,0,0,5,1324598400,GREAT SWEET CANDY!,3,This Product is Kosher!
19,B001GVISJM,A2A9X58G2GTBLP,Wolfee1,0,0,5,1324598400,GREAT SWEET CANDY!,4,Thank You
20,B001GVISJM,A3IV7CL2C13K2U,Greg,0,0,5,1318032000,Home delivered twizlers,0,Candy was delivered very fast and was purchased at a reasonable price.
20,B001GVISJM,A3IV7CL2C13K2U,Greg,0,0,5,1318032000,Home delivered twizlers,1,I was home bound and unable to get to a store so this was perfect for me.
21,B001GVISJM,A1WO0KGLPR5PV6,mom2emma,0,0,5,1313452800,Always fresh,0,My husband is a Twizzlers addict.
21,B001GVISJM,A1WO0KGLPR5PV6,mom2emma,0,0,5,1313452800,Always fresh,1,We've bought these many times from Amazon because we're government employees living overseas and can't get them in the country we are assigned to.
21,B001GVISJM,A1WO0KGLPR5PV6,mom2emma,0,0,5,1313452800,Always fresh,2,"They've always been fresh and tasty, packed well and arrive in a timely manner."
22,B001GVISJM,AZOF9E17RGZH8,Tammy Anderson,0,0,5,1308960000,TWIZZLERS,0,I bought these for my husband who is currently overseas.
22,B001GVISJM,AZOF9E17RGZH8,Tammy Anderson,0,0,5,1308960000,TWIZZLERS,1,"He loves these, and apparently his staff likes them also."
22,B001GVISJM,AZOF9E17RGZH8,Tammy Anderson,0,0,5,1308960000,TWIZZLERS,2,"<br />There are generous amounts of Twizzlers in each 16-ounce bag, and this was well worth the price."
22,B001GVISJM,AZOF9E17RGZH8,Tammy Anderson,0,0,5,1308960000,TWIZZLERS,3,"<a href=""http://www.amazon.com/gp/product/B001GVISJM"">Twizzlers, Strawberry, 16-Ounce Bags (Pack of 6)</a>"
23,B001GVISJM,ARYVQL4N737A1,Charles Brown,0,0,5,1304899200,Delicious product!,0,I can remember buying this candy as a kid and the quality hasn't dropped in all these years.
23,B001GVISJM,ARYVQL4N737A1,Charles Brown,0,0,5,1304899200,Delicious product!,1,Still a superb product you won't be disappointed with.
24,B001GVISJM,AJ613OLZZUG7V,Mare's,0,0,5,1304467200,Twizzlers,0,I love this candy.
24,B001GVISJM,AJ613OLZZUG7V,Mare's,0,0,5,1304467200,Twizzlers,1,After weight watchers I had to cut back but still have a craving for it.
25,B001GVISJM,A22P2J09NJ9HKE,"S. Cabanaugh ""jilly pepper""",0,0,5,1295481600,Please sell these in Mexico!!,0,"I have lived out of the US for over 7 yrs now, and I so miss my Twizzlers!!"
25,B001GVISJM,A22P2J09NJ9HKE,"S. Cabanaugh ""jilly pepper""",0,0,5,1295481600,Please sell these in Mexico!!,1,"When I go back to visit or someone visits me, I always stock up."
25,B001GVISJM,A22P2J09NJ9HKE,"S. Cabanaugh ""jilly pepper""",0,0,5,1295481600,Please sell these in Mexico!!,2,All I can say is YUM!
25,B001GVISJM,A22P2J09NJ9HKE,"S. Cabanaugh ""jilly pepper""",0,0,5,1295481600,Please sell these in Mexico!!,3,"<br />Sell these in Mexico and you will have a faithful buyer, more often than I'm able to buy them right now."
26,B001GVISJM,A3FONPR03H3PJS,"Deborah S. Linzer ""Cat Lady""",0,0,5,1288310400,Twizzlers - Strawberry,0,Product received is as advertised.
26,B001GVISJM,A3FONPR03H3PJS,"Deborah S. Linzer ""Cat Lady""",0,0,5,1288310400,Twizzlers - Strawberry,1,"<br /><br /><a href=""http://www.amazon.com/gp/product/B001GVISJM"">Twizzlers, Strawberry, 16-Ounce Bags (Pack of 6)</a>"
27,B001GVISJM,A3RXAU2N8KV45G,lady21,0,1,1,1332633600,Nasty No flavor,0,"The candy is just red , No flavor ."
27,B001GVISJM,A3RXAU2N8KV45G,lady21,0,1,1,1332633600,Nasty No flavor,1,Just  plan and chewy .
27,B001GVISJM,A3RXAU2N8KV45G,lady21,0,1,1,1332633600,Nasty No flavor,2,I would never buy them again
28,B001GVISJM,AAAS38B98HMIK,Heather Dube,0,1,4,1331856000,Great Bargain for the Price,0,I was so glad Amazon carried these batteries.
28,B001GVISJM,AAAS38B98HMIK,Heather Dube,0,1,4,1331856000,Great Bargain for the Price,1,I have a hard time finding them elsewhere because they are such a unique size.
28,B001GVISJM,AAAS38B98HMIK,Heather Dube,0,1,4,1331856000,Great Bargain for the Price,2,I need them for my garage door opener.
28,B001GVISJM,AAAS38B98HMIK,Heather Dube,0,1,4,1331856000,Great Bargain for the Price,3,<br />Great deal for the price.
29,B00144C10S,A2F4LZVGFLD1OB,DaisyH,0,0,5,1338854400,YUMMY!,0,"I got this for my Mum who is not diabetic but needs to watch her sugar intake, and my father who simply chooses to limit unnecessary sugar intake - she's the one with the sweet tooth - they both LOVED these toffees, you would never guess that they're sugar-free and it's so great that you can eat them pretty much guilt free!"
29,B00144C10S,A2F4LZVGFLD1OB,DaisyH,0,0,5,1338854400,YUMMY!,1,i was so impressed that i've ordered some for myself (w dark chocolate) to take to the office so i'll eat them instead of snacking on sugary sweets.
29,B00144C10S,A2F4LZVGFLD1OB,DaisyH,0,0,5,1338854400,YUMMY!,2,<br />These are just EXCELLENT!
30,B0001PB9FY,A3HDKO7OW0QNK4,Canadian Fan,1,1,5,1107820800,The Best Hot Sauce in the World,0,"I don't know if it's the cactus or the tequila or just the unique combination of ingredients, but the flavour of this hot sauce makes it one of a kind!"
30,B0001PB9FY,A3HDKO7OW0QNK4,Canadian Fan,1,1,5,1107820800,The Best Hot Sauce in the World,1,We picked up a bottle once on a trip we were on and brought it back home with us and were totally blown away!
30,B0001PB9FY,A3HDKO7OW0QNK4,Canadian Fan,1,1,5,1107820800,The Best Hot Sauce in the World,2,When we realized that we simply couldn't find it anywhere in our city we were bummed.
30,B0001PB9FY,A3HDKO7OW0QNK4,Canadian Fan,1,1,5,1107820800,The Best Hot Sauce in the World,3,"<br /><br />Now, because of the magic of the internet, we have a case of the sauce and are ecstatic because of it."
30,B0001PB9FY,A3HDKO7OW0QNK4,Canadian Fan,1,1,5,1107820800,The Best Hot Sauce in the World,4,<br /><br />If you love hot sauce.
30,B0001PB9FY,A3HDKO7OW0QNK4,Canadian Fan,1,1,5,1107820800,The Best Hot Sauce in the World,5,.
30,B0001PB9FY,A3HDKO7OW0QNK4,Canadian Fan,1,1,5,1107820800,The Best Hot Sauce in the World,6,"I mean really love hot sauce, but don't want a sauce that tastelessly burns your throat, grab a bottle of Tequila Picante Gourmet de Inclan."
30,B0001PB9FY,A3HDKO7OW0QNK4,Canadian Fan,1,1,5,1107820800,The Best Hot Sauce in the World,7,"Just realize that once you taste it, you will never want to use any other sauce."
30,B0001PB9FY,A3HDKO7OW0QNK4,Canadian Fan,1,1,5,1107820800,The Best Hot Sauce in the World,8,"<br /><br />Thank you for the personal, incredible service!"
31,B003F6UO7K,AFM0O9480F04W,Sherril,0,0,5,1297641600,Great machine!,0,I have never been a huge coffee fan.
31,B003F6UO7K,AFM0O9480F04W,Sherril,0,0,5,1297641600,Great machine!,1,"However, my mother purchased this little machine and talked me into trying the Latte Macciato."
31,B003F6UO7K,AFM0O9480F04W,Sherril,0,0,5,1297641600,Great machine!,2,"No Coffee Shop has a better one and I like most of the other products, too (as a usually non-coffee drinker!)"
31,B003F6UO7K,AFM0O9480F04W,Sherril,0,0,5,1297641600,Great machine!,3,.
31,B003F6UO7K,AFM0O9480F04W,Sherril,0,0,5,1297641600,Great machine!,4,<br />The little Dolche Guesto Machine is super easy to use and prepares a really good Coffee/Latte/Cappuccino/etc in less than a minute (if water is heated up).
31,B003F6UO7K,AFM0O9480F04W,Sherril,0,0,5,1297641600,Great machine!,5,I would recommend the Dolce Gusto to anyone.
31,B003F6UO7K,AFM0O9480F04W,Sherril,0,0,5,1297641600,Great machine!,6,Too good for the price and I'am getting one myself!
31,B003F6UO7K,AFM0O9480F04W,Sherril,0,0,5,1297641600,Great machine!,7,:)
32,B003F6UO7K,A31OQO709M20Y7,"Molly V. Smith ""staral""",0,1,5,1288310400,THIS IS MY TASTE...,0,"This offer is a great price and a great taste, thanks Amazon for selling this product."
32,B003F6UO7K,A31OQO709M20Y7,"Molly V. Smith ""staral""",0,1,5,1288310400,THIS IS MY TASTE...,1,<br /><br />Staral
33,B001EO5QW8,AOVROBZ8BNTP7,S. Potter,19,19,4,1163376000,Best of the Instant Oatmeals,0,McCann's Instant Oatmeal is great if you must have your oatmeal but can only scrape together two or three minutes to prepare it.
33,B001EO5QW8,AOVROBZ8BNTP7,S. Potter,19,19,4,1163376000,Best of the Instant Oatmeals,1,"There is no escaping the fact, however, that even the best instant oatmeal is nowhere near as good as even a store brand of oatmeal requiring stovetop preparation."
33,B001EO5QW8,AOVROBZ8BNTP7,S. Potter,19,19,4,1163376000,Best of the Instant Oatmeals,2,"Still, the McCann's is as good as it gets for instant oatmeal."
33,B001EO5QW8,AOVROBZ8BNTP7,S. Potter,19,19,4,1163376000,Best of the Instant Oatmeals,3,"It's even better than the organic, all-natural brands I have tried."
33,B001EO5QW8,AOVROBZ8BNTP7,S. Potter,19,19,4,1163376000,Best of the Instant Oatmeals,4,All the varieties in the McCann's variety pack taste good.
33,B001EO5QW8,AOVROBZ8BNTP7,S. Potter,19,19,4,1163376000,Best of the Instant Oatmeals,5,It can be prepared in the microwave or by adding boiling water so it is convenient in the extreme when time is an issue.
33,B001EO5QW8,AOVROBZ8BNTP7,S. Potter,19,19,4,1163376000,Best of the Instant Oatmeals,6,<br /><br />McCann's use of actual cane sugar instead of high fructose corn syrup helped me decide to buy this product.
33,B001EO5QW8,AOVROBZ8BNTP7,S. Potter,19,19,4,1163376000,Best of the Instant Oatmeals,7,Real sugar tastes better and is not as harmful as the other stuff.
33,B001EO5QW8,AOVROBZ8BNTP7,S. Potter,19,19,4,1163376000,Best of the Instant Oatmeals,8,"One thing I do not like, though, is McCann's use of thickeners."
33,B001EO5QW8,AOVROBZ8BNTP7,S. Potter,19,19,4,1163376000,Best of the Instant Oatmeals,9,"Oats plus water plus heat should make a creamy, tasty oatmeal without the need for guar gum."
33,B001EO5QW8,AOVROBZ8BNTP7,S. Potter,19,19,4,1163376000,Best of the Instant Oatmeals,10,But this is a convenience product.
33,B001EO5QW8,AOVROBZ8BNTP7,S. Potter,19,19,4,1163376000,Best of the Instant Oatmeals,11,"Maybe the guar gum is why, after sitting in the bowl a while, the instant McCann's becomes too thick and gluey."
34,B001EO5QW8,A3PMM0NFVEJGK9,"Megan ""Bad at Nicknames""",13,13,4,1166313600,Good Instant,0,This is a good instant oatmeal from the best oatmeal brand.
34,B001EO5QW8,A3PMM0NFVEJGK9,"Megan ""Bad at Nicknames""",13,13,4,1166313600,Good Instant,1,"It uses cane sugar instead of high fructouse corn syrup, so not only does it have a better sweetness, but some doctors now say that this form of sugar is better for you."
34,B001EO5QW8,A3PMM0NFVEJGK9,"Megan ""Bad at Nicknames""",13,13,4,1166313600,Good Instant,2,Great on a cold morning when you don't have time to make McCann's Steel Cut Oats.
34,B001EO5QW8,A3PMM0NFVEJGK9,"Megan ""Bad at Nicknames""",13,13,4,1166313600,Good Instant,3,The apple cinnamon is the best but the maple and brown sugar or the regular are good too.
34,B001EO5QW8,A3PMM0NFVEJGK9,"Megan ""Bad at Nicknames""",13,13,4,1166313600,Good Instant,4,Plus they don't require doctoring to actually tell the three flavors apart.
35,B001EO5QW8,A2EB6OGOWCRU5H,CorbyJames,9,9,5,1175212800,Great Irish oatmeal for those in a hurry!,0,Instant oatmeal can become soggy the minute the water hits the bowl.
35,B001EO5QW8,A2EB6OGOWCRU5H,CorbyJames,9,9,5,1175212800,Great Irish oatmeal for those in a hurry!,1,"McCann's Instant Oatmeal holds its texture, has excellent flavor, and is good for you all at the same time."
35,B001EO5QW8,A2EB6OGOWCRU5H,CorbyJames,9,9,5,1175212800,Great Irish oatmeal for those in a hurry!,2,"McCann's regular oat meal is excellent, too, but may take a bit longer to prepare than most have time for in the morning."
35,B001EO5QW8,A2EB6OGOWCRU5H,CorbyJames,9,9,5,1175212800,Great Irish oatmeal for those in a hurry!,3,"This is the best instant brand I've ever eaten, and a very close second to the non-instant variety."
35,B001EO5QW8,A2EB6OGOWCRU5H,CorbyJames,9,9,5,1175212800,Great Irish oatmeal for those in a hurry!,4,"<br /><br />McCann's Instant Irish Oatmeal, Variety Pack of Regular, Apples & Cinnamon, and Maple & Brown Sugar, 10-Count Boxes (Pack of 6)"
36,B001EO5QW8,A2CI0RLADCRKPF,T. J. Ryan,3,3,4,1210464000,satisfying,0,"McCann's Instant Irish Oatmeal, Variety Pack of Regular, Apples & Cinnamon, and Maple & Brown Sugar, 10-Count Boxes (Pack of 6)<br /><br />I'm a fan of the McCann's steel-cut oats, so I thought I'd give the instant variety a try."
36,B001EO5QW8,A2CI0RLADCRKPF,T. J. Ryan,3,3,4,1210464000,satisfying,1,"I found it to be a hardy meal, not too sweet, and great for folks like me (post-bariatric surgery) who need food that is palatable, easily digestible, with fiber but won't make you bloat."
37,B001EO5QW8,A1MYS9LFFBIYKM,"Abby Chase ""gluten free""",2,2,5,1190851200,Love Gluten Free Oatmeal!!!,0,For those of us with celiac disease this product is a lifesaver and what could be better than getting it at almost half the price of the grocery or health food store!
37,B001EO5QW8,A1MYS9LFFBIYKM,"Abby Chase ""gluten free""",2,2,5,1190851200,Love Gluten Free Oatmeal!!!,1,I love McCann's instant oatmeal - all flavors!!!
37,B001EO5QW8,A1MYS9LFFBIYKM,"Abby Chase ""gluten free""",2,2,5,1190851200,Love Gluten Free Oatmeal!!!,2,"<br /><br />Thanks,<br />Abby"
38,B001EO5QW8,A3MGP2E1ZZ6GRB,"Zardoz ""focuspuller""",1,1,5,1238457600,it's oatmeal,0,What else do you need to know?
38,B001EO5QW8,A3MGP2E1ZZ6GRB,"Zardoz ""focuspuller""",1,1,5,1238457600,it's oatmeal,1,"Oatmeal, instant (make it with a half cup of low-fat milk and add raisins;nuke for 90 seconds)."
38,B001EO5QW8,A3MGP2E1ZZ6GRB,"Zardoz ""focuspuller""",1,1,5,1238457600,it's oatmeal,2,More expensive than Kroger store brand oatmeal and maybe a little tastier or better texture or something.
